{
  "$schema": "https://json-schema.org/draft/2020-12/schema",
  "$id": "https://raw.githubusercontent.com/kevinpita/nix-skills/main/registry/schema.json",
  "title": "Nix Skills registry entry",
  "type": "object",
  "additionalProperties": false,
  "required": [
    "slug",
    "displayName",
    "description",
    "license",
    "author",
    "compatibleTargets",
    "source"
  ],
  "properties": {
    "slug": {
      "type": "string",
      "pattern": "^[a-z0-9]+(?:-[a-z0-9]+)*$"
    },
    "displayName": {
      "type": "string",
      "minLength": 1
    },
    "description": {
      "type": "string",
      "minLength": 1
    },
    "license": {
      "type": "string",
      "minLength": 1
    },
    "author": {
      "type": "string",
      "minLength": 1
    },
    "homepage": {
      "type": "string"
    },
    "version": {
      "type": "string"
    },
    "tags": {
      "type": "array",
      "items": {
        "type": "string"
      },
      "uniqueItems": true
    },
    "compatibleTargets": {
      "type": "array",
      "items": {
        "type": "string",
        "pattern": "^[a-z0-9]+(?:-[a-z0-9]+)*$|^\\*$"
      },
      "uniqueItems": true,
      "minItems": 1
    },
    "dependencies": {
      "type": "array",
      "items": {
        "type": "string",
        "pattern": "^[a-z0-9]+(?:-[a-z0-9]+)*$"
      },
      "uniqueItems": true
    },
    "source": {
      "type": "object",
      "additionalProperties": false,
      "required": [
        "type",
        "owner",
        "repo",
        "rev",
        "path",
        "narHash"
      ],
      "properties": {
        "type": {
          "const": "github"
        },
        "owner": {
          "type": "string",
          "minLength": 1
        },
        "repo": {
          "type": "string",
          "minLength": 1
        },
        "rev": {
          "type": "string",
          "pattern": "^[0-9a-f]{40}$"
        },
        "path": {
          "type": "string",
          "minLength": 1
        },
        "narHash": {
          "type": "string",
          "pattern": "^sha256-[A-Za-z0-9+/=]+$"
        }
      }
    }
  }
}
