{
  "slug": "writing-great-skills",
  "displayName": "Writing Great Skills",
  "description": "Reference for writing and editing skills well: the vocabulary and principles that make a skill predictable.",
  "license": "MIT",
  "author": "Matt Pocock",
  "homepage": "https://github.com/mattpocock/skills/tree/2ab958093e83e0ec752e6c1c5932da465bf23e0c/skills/productivity/writing-great-skills",
  "tags": [
    "productivity",
    "skills",
    "documentation"
  ],
  "compatibleTargets": [
    "*"
  ],
  "source": {
    "type": "github",
    "owner": "mattpocock",
    "repo": "skills",
    "rev": "2ab958093e83e0ec752e6c1c5932da465bf23e0c",
    "path": "skills/productivity/writing-great-skills",
    "narHash": "sha256-dQtG6usJWlg/FqTajrjcs8GSdymH92WsgLiUaCfvKPA="
  }
}
