{
  "slug": "grilling",
  "displayName": "Grilling",
  "description": "Interview the user relentlessly about a plan or design until decisions and dependencies are clear.",
  "license": "MIT",
  "author": "Matt Pocock",
  "homepage": "https://github.com/mattpocock/skills/tree/9c9f36ccd3995266cd675468af71639c8dde1ec5/skills/productivity/grilling",
  "tags": [
    "productivity",
    "planning",
    "design"
  ],
  "compatibleTargets": [
    "*"
  ],
  "source": {
    "type": "github",
    "owner": "mattpocock",
    "repo": "skills",
    "rev": "9c9f36ccd3995266cd675468af71639c8dde1ec5",
    "path": "skills/productivity/grilling",
    "narHash": "sha256-CJNC5fORkc+FGd+FlCXG6rZcVv2MCqCNHCVC0AW623Q="
  }
}
