{
  "slug": "domain-modeling",
  "displayName": "Domain Modeling",
  "description": "Build and sharpen a project's domain model, glossary, and durable architectural decisions.",
  "license": "MIT",
  "author": "Matt Pocock",
  "homepage": "https://github.com/mattpocock/skills/tree/2ab958093e83e0ec752e6c1c5932da465bf23e0c/skills/engineering/domain-modeling",
  "tags": [
    "engineering",
    "architecture",
    "documentation"
  ],
  "compatibleTargets": [
    "*"
  ],
  "source": {
    "type": "github",
    "owner": "mattpocock",
    "repo": "skills",
    "rev": "2ab958093e83e0ec752e6c1c5932da465bf23e0c",
    "path": "skills/engineering/domain-modeling",
    "narHash": "sha256-dQtG6usJWlg/FqTajrjcs8GSdymH92WsgLiUaCfvKPA="
  }
}
