{
  "slug": "grill-with-docs",
  "displayName": "Grill With Docs",
  "description": "Run a relentless planning interview that sharpens a design and records docs as the plan evolves.",
  "license": "MIT",
  "author": "Matt Pocock",
  "homepage": "https://github.com/mattpocock/skills/tree/8b36d4fb2635b3c21998dcd8144439c9e5ba7302/skills/engineering/grill-with-docs",
  "tags": [
    "engineering",
    "planning",
    "documentation"
  ],
  "compatibleTargets": [
    "*"
  ],
  "dependencies": [
    "domain-modeling",
    "grilling"
  ],
  "source": {
    "type": "github",
    "owner": "mattpocock",
    "repo": "skills",
    "rev": "8b36d4fb2635b3c21998dcd8144439c9e5ba7302",
    "path": "skills/engineering/grill-with-docs",
    "narHash": "sha256-RwFJdrPnyieN65QrwSfABRuBzMdyUIf/qoJ1M8zLLps="
  }
}
