{
  "slug": "handoff",
  "displayName": "Handoff",
  "description": "Compact the current conversation into a handoff document for another agent to pick up.",
  "license": "MIT",
  "author": "Matt Pocock",
  "homepage": "https://github.com/mattpocock/skills/tree/9c9f36ccd3995266cd675468af71639c8dde1ec5/skills/productivity/handoff",
  "tags": [
    "productivity",
    "handoff",
    "documentation"
  ],
  "compatibleTargets": [
    "*"
  ],
  "source": {
    "type": "github",
    "owner": "mattpocock",
    "repo": "skills",
    "rev": "9c9f36ccd3995266cd675468af71639c8dde1ec5",
    "path": "skills/productivity/handoff",
    "narHash": "sha256-CJNC5fORkc+FGd+FlCXG6rZcVv2MCqCNHCVC0AW623Q="
  }
}
